{
    "name": "context_precision",
    "instruction": "Given question, answer and context verify if the context was useful in arriving at the given answer. Give verdict as \"1\" if useful and \"0\" if not with json output.",
    "output_format_instruction": "The output should be a well-formatted JSON instance that conforms to the JSON schema below.\n\nAs an example, for the schema {\"properties\": {\"foo\": {\"title\": \"Foo\", \"description\": \"a list of strings\", \"type\": \"array\", \"items\": {\"type\": \"string\"}}}, \"required\": [\"foo\"]}\nthe object {\"foo\": [\"bar\", \"baz\"]} is a well-formatted instance of the schema. The object {\"properties\": {\"foo\": [\"bar\", \"baz\"]}} is not well-formatted.\n\nHere is the output JSON schema:\n```\n{\"description\": \"Answer for the verification task wether the context was useful.\", \"type\": \"object\", \"properties\": {\"reason\": {\"title\": \"Reason\", \"description\": \"Reason for verification\", \"type\": \"string\"}, \"verdict\": {\"title\": \"Verdict\", \"description\": \"Binary (0/1) verdict of verification\", \"type\": \"integer\"}}, \"required\": [\"reason\", \"verdict\"]}\n```\n\nDo not return any preamble or explanations, return only a pure JSON string surrounded by triple backticks (```).",
    "examples": [
        {
            "question": "你能告诉我关于阿尔伯特·爱因斯坦的事情吗？",
            "context": "阿尔伯特·爱因斯坦（Albert Einstein，1879年3月14日—1955年4月18日）是出生于德国的理论物理学家，被广泛认为是史上最伟大的、最具影响力的科学家之一。他最为人所知的是发展了相对论，也对量子力学做出了重要贡献，因此在二十世纪前几十年现代物理学对自然科学的革命性重塑中成为核心人物。他提出的质能等价公式E=mc²源自相对论理论，被称为“世界上最著名的公式”。他因“对理论物理学的贡献，特别是发现光电效应定律”而获得1921年诺贝尔物理学奖，这是量子理论发展中的一个关键步骤。他的工作也因其对科学哲学的影响而闻名。在1999年英国《物理世界》杂志对全球130位顶尖物理学家进行的民意调查中，爱因斯坦被评为最伟大的物理学家。他的智力成就和独创性使爱因斯坦成为天才的同义词。",
            "answer": "阿尔伯特·爱因斯坦（Albert Einstein）出生于1879年3月14日，是德国出生的理论物理学家，被广泛认为是史上最伟大的、最有影响力的科学家之一。他因对理论物理学的贡献而荣获1921年诺贝尔物理学奖。他在1905年发表了4篇论文。爱因斯坦于1895年移居瑞士。",
            "verification": {
                "reason": "所提供的上下文对于得出给定答案确实很有帮助。该上下文包含了关于阿尔伯特·爱因斯坦的生活和贡献的关键信息，这些信息在答案中得到了体现。",
                "verdict": 1
            }
        },
        {
            "question": "2020年国际冠军杯的冠军是谁？",
            "context": "2022年国际板球总会（ICC）男子T20世界杯于2022年10月16日至11月13日在澳大利亚举行，是该项赛事的第八届。原定于2020年举行，因新冠疫情而推迟。英格兰队在决赛中以五局之差击败巴基斯坦队，夺得第二个ICC男子T20世界杯冠军。",
            "answer": "英格兰",
            "verification": {
                "reason": "该上下文有助于澄清2020年国际冠军杯的相关情况，并表明英格兰是原定于2020年举行但实际上在2022年举行的锦标赛的冠军。",
                "verdict": 1
            }
        },
        {
            "question": "世界上最高的山峰是什么？",
            "context": "安第斯山脉是世界上最长的陆上山脉，位于南美洲。它跨越七个国家，拥有西半球许多最高的山峰。该山脉以多样的生态系统而闻名，包括高海拔的安第斯高原和亚马逊雨林。",
            "answer": "珠穆朗玛峰。",
            "verification": {
                "reason": "所提供的上下文讨论了安第斯山脉，虽然令人印象深刻，但并不包括珠穆朗玛峰，也没有直接涉及到关于世界最高峰的问题。",
                "verdict": 0
            }
        }
    ],
    "input_keys": [
        "question",
        "context",
        "answer"
    ],
    "output_key": "verification",
    "output_type": "json",
    "language": "chinese"
}